{
  "$schema": "https://json-schema.org/draft/2020-12/schema",
  "title": "GCCSEG Task Contract",
  "type": "object",
  "required": [
    "goal",
    "context",
    "capability",
    "state",
    "evidence",
    "gate"
  ],
  "properties": {
    "goal": {
      "type": "object",
      "required": [
        "success_criteria"
      ],
      "properties": {
        "success_criteria": {
          "type": "array",
          "minItems": 1,
          "items": {
            "type": "string"
          }
        }
      }
    },
    "context": {
      "type": "object",
      "required": [
        "facts"
      ],
      "properties": {
        "facts": {
          "type": "array",
          "items": {
            "type": "object",
            "required": [
              "claim",
              "classification",
              "source"
            ],
            "properties": {
              "claim": {
                "type": "string"
              },
              "classification": {
                "enum": [
                  "CURRENT",
                  "HISTORICAL",
                  "INFERRED",
                  "UNKNOWN"
                ]
              },
              "source": {
                "type": "string"
              },
              "event_at": {
                "type": "string",
                "format": "date-time"
              },
              "collected_at": {
                "type": "string",
                "format": "date-time"
              }
            }
          }
        }
      }
    },
    "capability": {
      "type": "object",
      "required": [
        "effective_config_ref"
      ],
      "properties": {
        "effective_config_ref": {
          "type": "string",
          "minLength": 1
        }
      }
    },
    "state": {
      "type": "object",
      "required": [
        "status",
        "next_action"
      ],
      "properties": {
        "status": {
          "type": "string"
        },
        "next_action": {
          "type": "string",
          "minLength": 1
        }
      }
    },
    "evidence": {
      "type": "array",
      "items": {
        "type": "object",
        "required": [
          "subject_id",
          "source",
          "event_at",
          "collected_at",
          "claim",
          "validation_result"
        ],
        "properties": {
          "subject_id": {
            "type": "string"
          },
          "source": {
            "type": "string"
          },
          "event_at": {
            "type": "string",
            "format": "date-time"
          },
          "collected_at": {
            "type": "string",
            "format": "date-time"
          },
          "claim": {
            "type": "string"
          },
          "validation_result": {
            "enum": [
              "PASS",
              "FAIL",
              "UNKNOWN"
            ]
          }
        }
      }
    },
    "gate": {
      "type": "object",
      "required": [
        "acceptance_criteria",
        "level"
      ],
      "properties": {
        "acceptance_criteria": {
          "type": "array",
          "minItems": 1,
          "items": {
            "type": "string"
          }
        },
        "level": {
          "enum": [
            "CLI_READY",
            "TASK_EXECUTED",
            "AUTONOMOUS_DISPATCHED",
            "FAILOVER_VERIFIED",
            "UNATTENDED_HANDOFF_VERIFIED"
          ]
        }
      }
    },
    "contract_version": {
      "type": "string",
      "enum": [
        "3.7",
        "3.8"
      ]
    },
    "task_level": {
      "type": "string",
      "enum": [
        "L0",
        "L1",
        "L2"
      ]
    },
    "goal_alignment": {
      "type": "object",
      "required": [
        "north_star",
        "user_visible_acceptance",
        "baseline",
        "work_to_goal_map",
        "progress",
        "next_goal_gap"
      ],
      "properties": {
        "north_star": {
          "type": "string",
          "minLength": 1
        },
        "user_visible_acceptance": {
          "type": "array",
          "minItems": 1,
          "items": {
            "type": "string",
            "minLength": 1
          }
        },
        "baseline": {
          "type": "object",
          "required": [
            "status",
            "evidence_ref"
          ],
          "properties": {
            "status": {
              "enum": [
                "PASS",
                "FAIL",
                "PARTIAL",
                "UNKNOWN"
              ]
            },
            "evidence_ref": {
              "type": "string",
              "minLength": 1
            }
          }
        },
        "work_to_goal_map": {
          "type": "array",
          "minItems": 1,
          "items": {
            "type": "object",
            "required": [
              "work_item_id",
              "goal_metric_id",
              "expected_change"
            ],
            "properties": {
              "work_item_id": {
                "type": "string",
                "minLength": 1
              },
              "goal_metric_id": {
                "type": "string",
                "minLength": 1
              },
              "expected_change": {
                "type": "string",
                "minLength": 1
              },
              "verified_change": {
                "type": "string"
              }
            }
          }
        },
        "progress": {
          "type": "object",
          "required": [
            "engineering_percent",
            "outcome_verified_points",
            "outcome_total_points"
          ],
          "properties": {
            "engineering_percent": {
              "type": [
                "number",
                "null"
              ],
              "minimum": 0,
              "maximum": 100
            },
            "outcome_verified_points": {
              "type": [
                "number",
                "null"
              ],
              "minimum": 0,
              "maximum": 100
            },
            "outcome_total_points": {
              "type": [
                "number",
                "null"
              ],
              "minimum": 0,
              "maximum": 100
            }
          }
        },
        "next_goal_gap": {
          "type": "string",
          "minLength": 1
        },
        "outcome_metrics": {
          "type": "array",
          "items": {
            "type": "object",
            "required": [
              "id",
              "weight",
              "verified_points",
              "status",
              "evidence_refs"
            ],
            "properties": {
              "id": {
                "type": "string",
                "minLength": 1
              },
              "weight": {
                "type": "number",
                "exclusiveMinimum": 0,
                "maximum": 100
              },
              "verified_points": {
                "type": "number",
                "minimum": 0,
                "maximum": 100
              },
              "status": {
                "enum": [
                  "UNKNOWN",
                  "FAIL",
                  "ISOLATED_PASS",
                  "REAL_PASS"
                ]
              },
              "evidence_refs": {
                "type": "array",
                "items": {
                  "type": "string"
                }
              }
            }
          }
        },
        "hard_gates": {
          "type": "array",
          "items": {
            "type": "object",
            "required": [
              "id",
              "status",
              "evidence_refs"
            ],
            "properties": {
              "id": {
                "type": "string",
                "minLength": 1
              },
              "status": {
                "enum": [
                  "PASS",
                  "FAIL",
                  "BLOCKED",
                  "UNKNOWN"
                ]
              },
              "evidence_refs": {
                "type": "array",
                "items": {
                  "type": "string"
                }
              }
            }
          }
        }
      }
    }
  },
  "additionalProperties": true,
  "allOf": [
    {
      "if": {
        "properties": {
          "contract_version": {
            "const": "3.8"
          }
        },
        "required": [
          "contract_version"
        ]
      },
      "then": {
        "required": [
          "task_level",
          "goal_alignment"
        ],
        "properties": {
          "task_level": {
            "enum": [
              "L1",
              "L2"
            ]
          }
        }
      }
    },
    {
      "if": {
        "properties": {
          "contract_version": {
            "const": "3.8"
          },
          "task_level": {
            "const": "L2"
          }
        },
        "required": [
          "contract_version",
          "task_level"
        ]
      },
      "then": {
        "properties": {
          "goal_alignment": {
            "required": [
              "outcome_metrics",
              "hard_gates"
            ],
            "properties": {
              "outcome_metrics": {
                "minItems": 1
              },
              "hard_gates": {
                "minItems": 1
              }
            }
          }
        }
      }
    }
  ]
}
